{
  "id": "keeper",
  "display_name": "Village keeper",
  "rig_family": "humanoid_v1",
  "modules": {"hair": "crop", "outfit": "tunic", "equipment": "none"},
  "palette": {
    "skin": "#CE9C72",
    "hair": "#3F382E",
    "dress": "#557762",
    "leather": "#5F4834",
    "metal": "#BDC4CE",
    "gem": "#247BCB",
    "socks": "#D6D0BF"
  }
}
