{
  "id": "farm_mira",
  "display_name": "Mira Lark",
  "rig_family": "humanoid_v1",
  "modules": {
    "hair": "bob",
    "outfit": "dress",
    "equipment": "none"
  },
  "palette": {
    "skin": "#CE9C72",
    "hair": "#70523C",
    "dress": "#A77A65",
    "leather": "#5F4834",
    "metal": "#BDC4CE",
    "gem": "#247BCB",
    "socks": "#D6D0BF"
  }
}
